{
  "schemaVersion": 1,
  "project": {
    "name": "Pawprint API",
    "description": "A tiny API for the world’s most documented pets.",
    "accent": "#ff6b4a"
  },
  "generatedAt": "2026-07-19T00:00:00.000Z",
  "generator": {
    "name": "codex",
    "model": "gpt-5.6"
  },
  "navigation": [
    {
      "label": "Start here",
      "items": [{ "label": "Introduction", "slug": "introduction" }]
    }
  ],
  "pages": [
    {
      "slug": "introduction",
      "title": "Build something pawsome",
      "description": "Make your first Pawprint API call.",
      "markdown": "# Build something pawsome\n\nThis page was generated by Codex from the API contract and implementation.\n\n## First request\n\n```bash\ncurl https://api.pawprint.test/v1/pets\n```",
      "sourceFiles": ["openapi.yaml", "src/routes/pets.ts"]
    }
  ]
}
